{"$schema":"https://json-schema.org/draft/2020-12/schema","title":"Multi-format Content Brief","type":"object","additionalProperties":false,"required":["schemaVersion","sourceEventId","campaignId","topicId","title","audience","objective","formats","evidence","claims","brandVersion"],"properties":{"schemaVersion":{"const":"1.0"},"sourceEventId":{"type":"string","minLength":1,"maxLength":128},"campaignId":{"type":"string","minLength":1,"maxLength":128},"topicId":{"type":"string","minLength":1,"maxLength":128},"title":{"type":"string","minLength":3,"maxLength":200},"audience":{"type":"string","minLength":2,"maxLength":200},"objective":{"type":"string","minLength":3,"maxLength":500},"formats":{"type":"array","minItems":1,"uniqueItems":true,"items":{"enum":["article","reel_script","carousel","email","short_video_script"]}},"evidence":{"type":"array","minItems":1,"maxItems":50,"items":{"type":"object","additionalProperties":false,"required":["evidenceId","title","summary","evidenceType"],"properties":{"evidenceId":{"type":"string","minLength":1,"maxLength":128},"title":{"type":"string","minLength":1,"maxLength":300},"summary":{"type":"string","minLength":1,"maxLength":2000},"sourceUrl":{"type":"string","format":"uri","pattern":"^https?://"},"evidenceType":{"enum":["simulated","source_verified"]}}}},"claims":{"type":"array","maxItems":50,"items":{"type":"object","additionalProperties":false,"required":["claimId","text","kind","evidenceIds"],"properties":{"claimId":{"type":"string","minLength":1,"maxLength":128},"text":{"type":"string","minLength":1,"maxLength":500},"kind":{"enum":["factual","opinion","instruction"]},"evidenceIds":{"type":"array","uniqueItems":true,"items":{"type":"string"}}}}},"brandVersion":{"type":"integer","minimum":1},"cta":{"type":"string","maxLength":120},"requestedBy":{"type":"string","maxLength":128}}}
