{"schemaVersion":"1.0","sourceEventId":"brief-001","campaignId":"reliability-series","topicId":"topic-retry-dlq","title":"How reliable automations recover from failure","audience":"automation builders","objective":"Explain idempotency, retry, and dead-letter queues without claiming that failures disappear.","formats":["article","reel_script","carousel","email","short_video_script"],"evidence":[{"evidenceId":"ev-01","title":"Local failure test","summary":"A deterministic fixture demonstrates successful delivery, bounded retry, and dead-letter routing.","sourceUrl":"https://example.test/evidence/failure-test","evidenceType":"simulated"},{"evidenceId":"ev-02","title":"Repository test result","summary":"The repository test suite validates duplicate suppression and permanent failure handling.","sourceUrl":"https://example.test/evidence/repository-test","evidenceType":"source_verified"}],"claims":[{"claimId":"claim-01","text":"Idempotency prevents a replayed event from creating the same side effect twice.","kind":"factual","evidenceIds":["ev-02"]},{"claimId":"claim-02","text":"A bounded retry policy sends exhausted failures to a dead-letter queue.","kind":"factual","evidenceIds":["ev-01","ev-02"]}],"brandVersion":1,"cta":"review the repository","requestedBy":"content-operator"}
