{"schemaVersion":"1.0","sourceEventId":"brief-unsupported","campaignId":"unsafe-series","topicId":"topic-guarantee","title":"Guaranteed revenue automation","audience":"small businesses","objective":"Claim guaranteed revenue from automation.","formats":["article"],"evidence":[{"evidenceId":"ev-sim","title":"Synthetic example","summary":"This is not real revenue evidence.","evidenceType":"simulated"}],"claims":[{"claimId":"claim-bad","text":"This automation guarantees revenue with zero risk.","kind":"factual","evidenceIds":[]}],"brandVersion":1,"cta":"buy now","requestedBy":"fixture"}
